verbo|traducao_tedesco|esempio|nivel
arrivare|ankommen|Wann kommt der Zug an?|A1
rispondere|antworten|Bitte antworten Sie schnell.|A1
lavorare|arbeiten|Ich arbeite von Montag bis Freitag.|A1
aprire|aufmachen|Kannst du bitte das Fenster aufmachen?|A1
alzarsi|aufstehen|Ich stehe jeden Morgen um 7 Uhr auf.|A1
compilare|ausfüllen|Bitte füllen Sie das Formular aus.|A1
sembrare, avere l'aspetto di|aussehen|Sie sieht müde aus.|A1
pronunciare|aussprechen|Wie spricht man dieses Wort aus?|A1
scendere (da un veicolo)|aussteigen|Wir müssen hier aussteigen.|A1
pagare|bezahlen|Ich möchte jetzt bezahlen.|A1
avere bisogno di|brauchen|Ich brauche Hilfe.|A1
portare|bringen|Kannst du mir einen Kaffee bringen?|A1
sillabare|buchstabieren|Können Sie das bitte buchstabieren?|A1
fare la doccia|duschen|Ich dusche jeden Morgen.|A1
fare la spesa|einkaufen|Ich gehe heute einkaufen.|A1
invitare|einladen|Ich lade dich zum Abendessen ein.|A1
addormentarsi|einschlafen|Ich bin spät eingeschlafen.|A1
salire (su un veicolo)|einsteigen|Bitte einsteigen!|A1
mangiare|essen|Was möchten Sie essen?|A1
guidare, andare (con veicolo)|fahren|Ich fahre mit dem Auto zur Arbeit.|A1
guardare la TV|fernsehen|Am Abend sehe ich gern fern.|A1
trovare|finden|Ich finde den Schlüssel nicht.|A1
volare|fliegen|Wir fliegen nach Spanien.|A1
fotografare|fotografieren|Er fotografiert gern Landschaften.|A1
chiedere|fragen|Ich möchte dich etwas fragen.|A1
fare colazione|frühstücken|Ich frühstücke um 8 Uhr.|A1
dare|geben|Kannst du mir bitte das Buch geben?|A1
andare|gehen|Wir gehen ins Kino.|A1
avere|haben|Ich habe ein neues Auto.|A1
tenere, fermare, mantenere|halten|Halten Sie hier bitte an.|A1
chiamarsi|heißen|Wie heißen Sie?|A1
riscaldare|heizen|Im Winter müssen wir die Wohnung heizen.|A1
prendere, andare a prendere|holen|Ich muss die Kinder aus der Schule holen.|A1
sentire, ascoltare|hören|Hörst du die Musik?|A1
comprare|kaufen|Was möchtest du kaufen?|A1
cucinare|kochen|Ich koche heute Abend Suppe.|A1
venire|kommen|Woher kommen Sie?|A1
potere, sapere (fare qualcosa)|können|Kannst du mir helfen?|A1
costare|kosten|Wie viel kostet das?|A1
malato (usato con sein)|krank|Ich bin krank.|A1
baciare|küssen|Er küsst seine Freundin.|A1
ridere|lachen|Sie lachen über den Witz.|A1
correre, camminare|laufen|Die Kinder laufen im Garten.|A1
vivere|leben|Ich lebe in Deutschland.|A1
mettere (sdraiato)|legen|Lege das Buch auf den Tisch.|A1
leggere|lesen|Ich lese gern Bücher.|A1
amare|lieben|Ich liebe dich.|A1
essere (sdraiato)|liegen|Das Buch liegt auf dem Tisch.|A1
risolvere|lösen|Kannst du die Aufgabe lösen?|A1
fare|machen|Was machst du heute Abend?|A1
segnare|markieren|Bitte markieren Sie die richtige Antwort.|A1
dovere|müssen|Ich muss jetzt gehen.|A1
prendere|nehmen|Nehmen Sie Platz.|A1
annotare|notieren|Bitte notieren Sie die Adresse.|A1
organizzare|organisieren|Wir müssen eine Party organisieren.|A1
fare le valigie, imballare|packen|Ich muss meine Koffer packen.|A1
parcheggiare|parken|Hier dürfen Sie nicht parken.|A1
andare bene, stare (vestiti)|passen|Die Hose passt mir nicht mehr.|A1
pianificare|planen|Wir planen unseren Urlaub.|A1
provare, assaggiare|probieren|Möchtest du den Kuchen probieren?|A1
pulire, spazzolare|putzen|Ich putze meine Zähne jeden Morgen.|A1
cancellare (con la gomma)|radieren|Ich habe einen Fehler gemacht und muss radieren.|A1
fumare|rauchen|Rauchen ist hier verboten.|A1
radere|rasieren|Er rasiert sich jeden Morgen.|A1
piovere|regnen|Es regnet heute den ganzen Tag.|A1
riparare|reparieren|Kannst du mein Fahrrad reparieren?|A1
prenotare|reservieren|Ich möchte einen Tisch reservieren.|A1
mescolare|rühren|Bitte rühren Sie den Zucker in den Kaffee.|A1
chiamare, gridare|rufen|Ich rufe dich später an.|A1
dire|sagen|Was hast du gesagt?|A1
collezionare, raccogliere|sammeln|Ich sammle Briefmarken.|A1
guardare|schauen|Schau mal! Ein Vogel!|A1
regalare|schenken|Ich schenke dir ein Buch.|A1
sparare|schießen|Er schießt auf das Tor.|A1
dormire|schlafen|Ich schlafe sieben Stunden pro Nacht.|A1
chiudere|schließen|Bitte schließen Sie die Tür.|A1
avere sapore, assaggiare|schmecken|Der Kuchen schmeckt gut.|A1
tagliare|schneiden|Kannst du das Brot schneiden?|A1
nevicare|schneien|Es schneit im Winter oft.|A1
scrivere|schreiben|Ich schreibe einen Brief.|A1
nuotare|schwimmen|Ich schwimme gern im See.|A1
vedere|sehen|Ich sehe dich.|A1
essere|sein|Ich bin müde.|A1
inviare, trasmettere|senden|Wir senden Ihnen eine E-Mail.|A1
sedere, essere seduto|sitzen|Er sitzt auf dem Stuhl.|A1
cantare|singen|Sie singt sehr schön.|A1
passeggiare|spazieren|Wir gehen gern spazieren.|A1
giocare, suonare|spielen|Die Kinder spielen im Garten.|A1
lavare (i piatti)|spülen|Ich muss noch das Geschirr spülen.|A1
iniziare, partire|starten|Der Flug startet um 10 Uhr.|A1
stare (in piedi)|stehen|Die Tasse steht auf dem Tisch.|A1
fermare|stoppen|Bitte stoppen Sie das Auto hier.|A1
studiare (all'università)|studieren|Sie studiert Medizin an der Universität.|A1
ballare|tanzen|Möchtest du tanzen gehen?|A1
telefonare|telefonieren|Ich muss telefonieren.|A1
portare, indossare|tragen|Sie trägt einen roten Pullover.|A1
praticare (sport)|treiben|Er treibt viel Sport.|A1
bere|trinken|Was möchten Sie trinken?|A1
capire|verstehen|Ich verstehe das nicht.|A1
presentare, immaginare|vorstellen|Darf ich mich vorstellen?|A1
decollare, partire (aereo)|abfliegen|Das Flugzeug ist pünktlich abgeflogen.|A2
cancellare l'iscrizione, disconnettersi|abmelden|Ich muss mich vom Kurs abmelden.|A2
asciugare (con asciugamano)|abtrocknen|Bitte trockne das Geschirr ab.|A2
vestire|anziehen|Zieh dir eine Jacke an, es ist kalt.|A2
accendere|anzünden|Kannst du bitte die Kerze anzünden?|A2
svegliarsi|aufwachen|Ich bin um 6 Uhr aufgewacht.|A2
fare il bagno, bagnarsi|baden|Ich bade gerne im Meer.|A2
cuocere al forno|backen|Sie backt einen Kuchen für die Party.|A2
fare lavoretti manuali|basteln|Die Kinder basteln ein Geschenk.|A2
rispondere a|beantworten|Bitte beantworten Sie die Frage.|A2
sbrigarsi|beeilen (sich)|Wir müssen uns beeilen!|A2
ricevere, ottenere|bekommen|Ich habe einen Brief bekommen.|A2
usare, utilizzare|benutzen|Darf ich dein Handy benutzen?|A2
riferire|berichten|Er berichtet über die Neuigkeiten.|A2
chiedere, pregare|bitten|Ich bitte dich um Hilfe.|A2
restare, rimanere|bleiben|Bleibst du heute zu Hause?|A2
friggere, arrostire|braten|Ich brate Hähnchen in der Pfanne.|A2
stirare|bügeln|Ich muss noch meine Hemden bügeln.|A2
ringraziare|danken|Ich danke dir für deine Hilfe.|A2
inserire|einfügen|Fügen Sie den Text hier ein.|A2
depositare (denaro)|einzahlen|Ich möchte Geld auf mein Konto einzahlen.|A2
ricordarsi|erinnern (sich)|Ich kann mich nicht daran erinnern.|A2
riposarsi, riprendersi|erholen (sich)|Ich muss mich von der Arbeit erholen.|A2
spiegare|erklären|Können Sie das bitte erklären?|A2
aspettare|erwarten|Ich erwarte einen Anruf.|A2
sbagliato (usato con sein)|falsch|Das ist falsch.|A2
inviare via fax|faxen|Ich muss das Dokument faxen.|A2
festeggiare|feiern|Wir feiern heute meinen Geburtstag.|A2
sentirsi|fühlen (sich)|Wie fühlen Sie sich heute?|A2
piacere|gefallen|Die neue Wohnung gefällt mir sehr gut.|A2
appartenere|gehören|Wem gehört dieses Buch?|A2
grigliare|grillen|Wir grillen heute Abend im Garten.|A2
appendere, essere appeso|hängen|Das Bild hängt an der Wand.|A2
sposarsi|heiraten|Sie heiraten nächsten Sommer.|A2
aiutare|helfen|Kann ich Ihnen helfen?|A2
tossire|husten|Er hustet die ganze Nacht.|A2
interessarsi a|interessieren (sich)|Ich interessiere mich für Sprachen.|A2
fare jogging|joggen|Ich jogge jeden Morgen im Park.|A2
pettinare|kämmen|Sie kämmt sich die Haare.|A2
conoscere|kennen|Ich kenne diesen Mann nicht.|A2
conoscere (per la prima volta)|kennenlernen|Ich möchte neue Leute kennenlernen.|A2
cliccare|klicken|Klicken Sie hier, um das Dokument zu öffnen.|A2
suonare (campanello, telefono)|klingeln|Es klingelt an der Tür.|A2
bussare|klopfen|Jemand klopft an die Tür.|A2
copiare|kopieren|Kannst du dieses Dokument kopieren?|A2
correggere|korrigieren|Der Lehrer korrigiert die Fehler.|A2
gratuito (usato come aggettivo)|kostenlos|Das Parken ist kostenlos.|A2
ottenere, prendere (colloquiale)|kriegen|Wo kriege ich Fahrkarten?|A2
fresco, freddo (usato con sein)|kühl|Es ist heute kühl.|A2
lasciare, permettere|lassen|Lass mich in Ruhe!|A2
prestare, prendere in prestito|leihen|Kannst du mir dein Buch leihen?|A2
cancellare, spegnere|löschen|Löschen Sie die Datei.|A2
inviare per e-mail|mailen (e-mailen)|Ich maile dir die Informationen.|A2
pensare, voler dire|meinen|Was meinst du dazu?|A2
notare, ricordare|merken|Merk dir das Datum.|A2
affittare|mieten|Wir wollen eine Wohnung mieten.|A2
mescolare, mischiare|mischen|Mischen Sie die Zutaten gut.|A2
portare (con sé)|mitbringen|Bringst du etwas zu essen mit?|A2
piacere (cose/persone)|mögen|Ich mag Schokolade.|A2
operare|operieren|Der Arzt muss ihn operieren.|A2
ordinare, sistemare|ordnen|Bitte ordne die Bücher im Regal.|A2
succedere|passieren|Was ist passiert?|A2
reagire|reagieren|Wie hat er reagiert?|A2
correre|rennen|Die Kinder rennen auf dem Spielplatz.|A2
aspirare (polvere)|saugen|Ich muss heute noch staubsaugen.|A2
sedersi|setzen (sich)|Setz dich bitte auf den Stuhl.|A2
salvare, memorizzare|speichern|Vergiss nicht, die Datei zu speichern.|A2
saltare|springen|Die Kinder springen auf dem Trampolin.|A2
infilare, mettere|stecken|Steck den Schlüssel in die Tasche.|A2
mettere (in piedi)|stellen|Stell die Flasche auf den Tisch.|A2
stressare|stressen|Die Arbeit stresst mich sehr.|A2
cercare|suchen (nach D)|Ich suche nach meinem Handy.|A2
partecipare a|teilnehmen an D|Möchten Sie am Kurs teilnehmen?|A2
testare|testen|Wir müssen das neue Programm testen.|A2
separarsi|trennen (sich)|Sie haben sich getrennt.|A2
asciugare|trocknen|Die Wäsche trocknet schnell in der Sonne.|A2
sognare di|träumen von D|Ich träume von einem Urlaub.|A2
incontrare|treffen|Wir treffen uns um 8 Uhr.|A2
calpestare, calciare|treten|Er tritt die Tür auf.|A2
cambiare (denaro, merce)|umtauschen|Ich möchte Euro in Dollar umtauschen.|A2
traslocare, cambiarsi (vestiti)|umziehen|Wir sind letztes Jahr umgezogen.|A2
dimenticare|vergessen|Ich habe meinen Schlüssel vergessen.|A2
essere sposato (con sein)|verheiraten|Sie ist verheiratet.|A2
cambiare, modificare|verändern|Das Leben verändert sich schnell.|A2
vendere|verkaufen|Ich möchte mein altes Auto verkaufen.|A2
essere innamorato di|verliebt sein in A|Er ist in sie verliebt.|A2
fidanzarsi|verloben (sich)|Sie haben sich verlobt.|A2
perdere|verlieren|Ich habe meinen Schlüssel verloren.|A2
perdere (opportunità, trasporto)|verpassen|Ich habe den Bus verpasst.|A2
promettere|versprechen|Ich verspreche es dir.|A2
tentare, provare|versuchen|Ich werde es versuchen.|A2
sostenere (esame)|ablegen|Er muss eine Prüfung ablegen.|B1
rifiutare, respingere|ablehnen|Sie hat mein Angebot abgelehnt.|B1
spegnere, rilassarsi|abschalten|Ich muss nach der Arbeit abschalten.|B1
chiudere a chiave, concludere|abschließen|Vergiss nicht, die Tür abzuschließen.|B1
annullare|absagen|Wir müssen den Termin absagen.|B1
concludere, completare|absolvieren|Sie hat ihr Studium erfolgreich absolviert.|B1
votare, coordinare|abstimmen|Wir müssen über den Vorschlag abstimmen.|B1
dividere, separare|abteilen|Man kann den Raum abteilen.|B1
aspettare|abwarten|Wir müssen die Ergebnisse abwarten.|B1
agire, recitare|agieren|Der Schauspieler agiert sehr überzeugend.|B1
cambiare, modificare|ändern|Sie sollten Ihre Meinung ändern.|B1
riconoscere, accettare|anerkennen|Man muss seine Fehler anerkennen.|B1
iniziare, cominciare|anfangen|Der Film fängt um 20 Uhr an.|B1
indossare|anhaben|Sie hat ein schönes Kleid an.|B1
fermare (veicolo), trattenere|anhalten|Der Bus hält an der nächsten Haltestelle.|B1
accettare, supporre|annehmen|Ich nehme an, du hast Hunger.|B1
provare (vestiti)|anprobieren|Möchten Sie diese Hose anprobieren?|B1
accendere (apparecchio), mettersi in fila|anstellen|Bitte stell den Fernseher an.|B1
aspirare a|anstreben|Sie strebt eine Karriere als Ärztin an.|B1
rinunciare, spedire|aufgeben|Ich gebe nicht auf!|B1
conservare, alzare, annullare|aufheben|Heb bitte den Stift auf.|B1
riagganciare (telefono), mettere|auflegen|Er hat einfach aufgelegt.|B1
registrare, accogliere, assorbire|aufnehmen|Wir nehmen ein Lied auf.|B1
formare, addestrare|ausbilden|Die Firma bildet neue Mitarbeiter aus.|B1
disimballare|auspacken|Ich muss noch meine Koffer auspacken.|B1
essere sufficiente|ausreichen|Das Geld reicht nicht aus.|B1
esaurire (vendita)|ausverkaufen|Das Konzert ist ausverkauft.|B1
osservare, prestare attenzione a|beachten|Bitte beachten Sie die Regeln.|B1
elaborare, modificare|bearbeiten|Ich muss diesen Text bearbeiten.|B1
minacciare|bedrohen|Der Klimawandel bedroht unsere Zukunft.|B1
influenzare|beeinflussen|Man sollte sich nicht so leicht beeinflussen lassen.|B1
promuovere, trasportare|befördern|Er wurde befördert.|B1
giustificare, fondare|begründen|Können Sie Ihre Meinung begründen?|B1
iniziare con|beginnen mit D|Wir beginnen mit dem Unterricht.|B1
offendere|beleidigen|Er hat mich beleidigt.|B1
notare, accorgersi|bemerken|Ich habe seinen Fehler bemerkt.|B1
consigliare|beraten|Der Experte berät uns.|B1
nominare, invocare|berufen|Er wurde in den Vorstand berufen.|B1
toccare|berühren|Man darf die Kunstwerke nicht berühren.|B1
occuparsi di|beschäftigen (sich mit D)|Ich beschäftige mich mit Sport.|B1
decidere, stabilire|beschließen|Wir haben beschlossen, umzuziehen.|B1
consistere in, essere composto da|bestehen aus D|Das Team besteht aus fünf Personen.|B1
determinare, definire|bestimmen|Du bestimmst, was wir machen.|B1
pregare|beten|Sie betet jeden Abend.|B1
prendersi cura di, supervisionare|betreuen|Sie betreut alte Menschen.|B1
muoversi, fare esercizio|bewegen (sich)|Man sollte sich regelmäßig bewegen.|B1
causare, provocare|bewirken|Seine Worte haben viel bewirkt.|B1
offrire|bieten|Das Restaurant bietet viele Gerichte.|B1
formare, costruire|bilden|Der Schnee bildet eine dicke Schicht.|B1
bloccare|blocken|Der Torwart konnte den Ball blocken.|B1
fiorire|blühen|Die Blumen blühen im Frühling.|B1
rompere|brechen|Er hat sich das Bein gebrochen.|B1
bruciare, ardere|brennen|Das Feuer brennt.|B1
spazzolare|bürsten|Sie bürstet ihr Haar.|B1
smorzare, cuocere al vapore|dämpfen|Das Gemüse wird gedämpft.|B1
durare|dauern|Wie lange dauert der Flug?|B1
servire|dienen|Dieses Werkzeug dient zum Öffnen von Flaschen.|B1
girare, voltare|drehen|Dreh dich bitte um.|B1
premere, spingere|drücken|Drück den Knopf.|B1
dare del tu|duzen|Wir duzen uns hier in der Firma.|B1
bocciare, fallire|durchfallen durch A|Er ist durch die Prüfung gefallen.|B1
annunciare|durchsagen|Die Ankunftszeit wurde durchgesagt.|B1
sposare (formale)|ehelichen|Er ehelichte seine Jugendliebe.|B1
affrettarsi|eilen|Ich muss eilen, sonst komme ich zu spät.|B1
venire in mente|einfallen|Mir ist eine gute Idee eingefallen.|B1
congelare|einfrieren|Man kann Brot einfrieren.|B1
introdurre, importare|einführen|Dieses neue Produkt wird im Herbst eingeführt.|B1
imballare, incartare|einpacken|Ich muss noch meine Geschenke einpacken.|B1
presentare, consegnare|einreichen|Bitte reichen Sie die Unterlagen bis Freitag ein.|B1
arredare, organizzare, installare|einrichten|Wir richten gerade unsere neue Wohnung ein.|B1
iscriversi, registrare|einschreiben|Sie möchte sich für den Kurs einschreiben.|B1
versare (bevanda)|einschenken|Soll ich dir noch einen Wein einschenken?|B1
assumere, regolare, smettere|einstellen|Die Firma stellt neue Mitarbeiter ein.|B1
entrare in (organizzazione, partito)|eintreten in A|Er ist in den Verein eingetreten.|B1
immigrare|einwandern|Viele Menschen wandern nach Deutschland ein.|B1
imbucare (lettera), inserire (moneta)|einwerfen|Bitte werfen Sie den Brief in den Briefkasten ein.|B1
rendere possibile|ermöglichen|Technologie ermöglicht uns vieles.|B1
nutrirsi|ernähren (sich)|Man sollte sich gesund ernähren.|B1
raggiungere, ottenere|erreichen|Ich konnte ihn telefonisch nicht erreichen.|B1
rendere difficile|erschweren|Der Regen erschwert die Fahrt.|B1
educare|erziehen|Sie erzieht ihre Kinder liebevoll.|B1
ottenere (risultato, obiettivo)|erzielen|Er hat ein gutes Ergebnis erzielt.|B1
esistere|exisitieren|Viele alte Traditionen existieren noch.|B1
abbattere (albero), emettere (sentenza)|fällen|Der Förster muss Bäume fällen.|B1
prendere, catturare|fangen|Der Hund fängt den Ball.|B1
afferrare, comprendere|fassen|Ich kann es nicht fassen!|B1
fissare, determinare|festlegen|Wir müssen den Termin festlegen.|B1
arrestare|festnehmen|Die Polizei hat den Dieb festgenommen.|B1
constatare, verificare|feststellen|Er stellte fest, dass die Tür offen war.|B1
filmare|filmen|Sie filmen eine Dokumentation.|B1
pescare|fischen|Wir fischen im Fluss.|B1
fluire, scorrere|fließen|Das Wasser fließt schnell.|B1
seguire|folgen|Folgen Sie mir bitte!|B1
promuovere, sostenere, estrarre|fördern|Die Regierung fördert kleine Unternehmen.|B1
esigere, rivendicare|fordern|Die Arbeiter fordern höhere Löhne.|B1
friggere (in olio)|frittieren|Pommes frites werden frittiert.|B1
riempire|füllen|Bitte füllen Sie das Glas mit Wasser.|B1
cuocere (fino al punto giusto)|garen|Das Fleisch muss noch garen.|B1
usare, utilizzare|gebrauchen|Man kann dieses alte Gerät noch gebrauchen.|B1
accadere, succedere|geschehen|Was ist geschehen?|B1
abituarsi a|gewöhnen (sich an A)|Ich muss mich an das neue Wetter gewöhnen.|B1
innaffiare, versare, fondere|gießen|Bitte gieß die Blumen.|B1
fondare, stabilire|gründen|Sie haben ein neues Unternehmen gegründet.|B1
dimezzarsi|halbieren (sich)|Die Zahl der Teilnehmer hat sich halbiert.|B1
agire, negoziare, trattare|handeln|Man muss schnell handeln.|B1
sollevare|heben|Er hebt das Paket hoch.|B1
sfidare|herausfordern|Diese Aufgabe fordert mich heraus.|B1
produrre, fabbricare|herstellen|Diese Firma stellt Autos her.|B1
sdraiarsi|hinlegen|Ich muss mich kurz hinlegen.|B1
sedersi|hinsetzen|Setz dich bitte hierhin.|B1
patire la fame|hungern|Viele Menschen hungern in dieser Region.|B1
informarsi con (qualcuno) su (qualcosa)|informieren (sich bei D über A)|Ich muss mich bei ihm über den Kurs informieren.|B1
installare|installieren|Wir müssen die neue Software installieren.|B1
internazionalizzare|internationalisieren|Das Unternehmen möchte seine Produkte internationalisieren.|B1
isolarsi da|isolieren (sich von D)|Manchmal möchte ich mich von allen isolieren.|B1
lottare, combattere|kämpfen|Sie kämpfen für ihre Rechte.|B1
accorciare, ridurre|kürzen|Man muss den Text kürzen.|B1
licenziare, rescindere, disdire|kündigen|Er hat seine Wohnung gekündigt.|B1
leccare|lecken an D|Der Hund leckt an seiner Pfote.|B1
soffrire di (malattia) / soffrire per (situazione)|leiden an A / unter D|Sie leidet an einer Erkältung.|B1
realizzare, permettersi|leisten|Er leistet gute Arbeit.|B1
dirigere, guidare, condurre|leiten|Sie leitet ein großes Team.|B1
insegnare|lehren|Er lehrt Englisch an der Universität.|B1
lodare|loben|Die Lehrerin lobt die Schüler.|B1
valere la pena|lohnen (sich)|Es lohnt sich, früh aufzustehen.|B1
mentire|lügen|Du sollst nicht lügen.|B1
gestire|managen|Sie managt ein internationales Projekt.|B1
segnalare, riferire, registrare|melden|Bitte melden Sie sich am Empfang.|B1
mobilitare|mobilisieren|Die neue Kampagne soll die Wähler mobilisieren.|B1
modernizzare|modernisieren|Die alte Küche wird modernisiert.|B1
arredare|möblieren|Die Wohnung ist komplett möbliert.|B1
pensare a, riflettere su|nachdenken über A|Ich muss über dein Angebot nachdenken.|B1
riempire di nuovo, ricaricare|nachfüllen|Kannst du bitte den Drucker nachfüllen?|B1
usare, sfruttare|nutzen|Nutzen Sie die Gelegenheit!|B1
aprire|öffnen|Das Geschäft öffnet um 9 Uhr.|B1
fischiare|pfeifen|Er pfeift ein Lied.|B1
piantare|pflanzen|Wir pflanzen Bäume im Garten.|B1
cogliere (fiori, frutta)|pflücken|Die Kinder pflücken Blumen.|B1
filosofare|philosophieren|Sie sitzen oft zusammen und philosophieren über das Leben.|B1
premiare|prämieren|Der beste Film wurde prämiert.|B1
calcolare, contare|rechnen|Kannst du schnell rechnen?|B1
ridurre|reduzieren|Wir müssen den Müll reduzieren.|B1
pulire, purificare|reinigen|Die Kleidung muss gereinigt werden.|B1
reclamare|reklamieren|Ich möchte diese Ware reklamieren.|B1
salvare|retten|Die Feuerwehr konnte das Kind retten.|B1
rischiare|riskieren|Er riskiert alles für seinen Traum.|B1
rotolare|rollen|Der Ball rollt den Hügel hinunter.|B1
salare|salzen|Bitte salzen Sie das Essen.|B1
riuscire, creare, farcela|schaffen|Ich schaffe das!|B1
stimare, apprezzare|schätzen|Ich schätze deine Hilfe sehr.|B1
brillare, sembrare|scheinen|Die Sonne scheint heute.|B1
spingere, far scorrere|schieben|Schieb den Stuhl näher heran.|B1
brutto, grave (usato con sein)|schlimm|Das ist nicht so schlimm.|B1
spingere fuori, forzare|abdrängen|Das Auto wurde von der Straße abgedrängt.|B2
partire (veicolo)|abfahren|Der Zug ist pünktlich abgefahren.|B2
prelevare (denaro), decollare|abheben|Ich möchte Geld vom Konto abheben.|B2
intercettare, origliare|abhören|Der Geheimdienst hat seine Telefongespräche abgehört.|B2
sostituire, staccarsi da|ablösen von D|Der neue Chef löst den alten ab.|B2
rimuovere (veicolo), rimorchiare|abschleppen|Mein Auto wurde abgeschleppt.|B2
tagliare, ottenere (risultato)|abschneiden|Er hat bei der Prüfung gut abgeschnitten.|B2
garantire, proteggere|absichern|Man muss die Baustelle absichern.|B2
investire (con veicolo), avviarsi|anfahren|Der Busfahrer hat eine Person angefahren.|B2
indicare, informare, vantarsi|angeben|Bitte geben Sie Ihre Daten an.|B2
guidare, citare|anführen|Er führte die Gruppe an.|B2
stimolare, incentivare|ankurbeln|Die Wirtschaft muss angekurbelt werden.|B2
allacciare (cintura di sicurezza)|anschnallen|Bitte schnallen Sie sich an.|B2
accumulare, arginare|anstauen|Das Wasser wird angestaut.|B2
istruire, designare|anweisen|Er wurde angewiesen, die Arbeit zu erledigen.|B2
espandere, migliorare, smontare|ausbauen|Wir wollen unser Geschäft ausbauen.|B2
essere annullato, cadere (capelli), mancare|ausfallen|Der Unterricht ist heute ausgefallen.|B2
equipaggiare con|ausstatten mit D|Das Zimmer ist mit modernen Möbeln ausgestattet.|B2
estinguersi|aussterben|Viele Tierarten sterben aus.|B2
emettere, espellere|ausstoßen|Fabriken stoßen viel CO2 aus.|B2
espandersi, allargarsi|ausweiten (sich)|Der Konflikt könnte sich ausweiten.|B2
rivendicare, esigere, sovraccaricare|beanspruchen|Die Arbeit beansprucht viel Zeit.|B2
percorrere, navigare|befahren|Dieses Gebiet darf nicht befahren werden.|B2
temere|befürchten|Ich befürchte das Schlimmste.|B2
comprendere, capire|begreifen|Ich begreife das Problem nicht.|B2
confessare, dichiararsi|bekennen (sich)|Er hat sich zu seiner Schuld bekannt.|B2
gravare, caricare, inquinare|belasten|Der Verkehr belastet die Umwelt.|B2
infastidire, molestare|belästigen|Er hat sie belästigt.|B2
necessitare, aver bisogno di|benötigen|Wir benötigen mehr Informationen.|B2
dare un voto, classificare|benoten|Der Lehrer benotet die Schüler.|B2
nascondere, contenere, salvare|bergen|Die Truhe birgt einen Schatz.|B2
occupare, riempire (posto)|besetzen|Die Stelle ist bereits besetzt.|B2
eliminare, rimuovere|beseitigen|Man muss das Problem beseitigen.|B2
confermare, comprovare|bestätigen|Bitte bestätigen Sie den Empfang der E-Mail.|B2
attivarsi, esercitare (attività)|betätigen (sich)|Er betätigt sich politisch.|B2
gestire, praticare, esercitare|betreiben|Er betreibt ein kleines Geschäft.|B2
mettere a letto, sistemare|betten|Sie bettete das Baby sanft in sein Bett.|B2
preservare, conservare|bewahren|Man muss die Natur bewahren.|B2
valutare, giudicare|bewerten|Der Professor bewertet die Arbeiten.|B2
concedere, autorizzare|bewilligen|Der Antrag wurde bewilligt.|B2
legare, unire|binden|Er bindet seine Schuhe.|B2
soffiare|blasen|Der Wind bläst stark.|B2
lampeggiare, fare un flash (radar)|blitzen|Es blitzt am Himmel.|B2
bloccare|blockieren|Die Straße ist blockiert.|B2
produrre (birra), preparare (tempesta)|brauen|Er braut sein eigenes Bier.|B2
applicare crema|cremen|Sie cremt sich jeden Morgen ein.|B2
coprire, apparecchiare|decken|Sie deckt den Tisch für das Abendessen.|B2
realizzare, eseguire|durchführen|Wir werden eine Umfrage durchführen.|B2
attraversare correndo, percorrere|durchlaufen|Er hat eine harte Schule durchlaufen.|B2
accettare, rispondere a|eingehen auf A|Er geht auf ihre Wünsche ein.|B2
intervenire in|eingreifen in A|Die Regierung muss eingreifen.|B2
stimare, valutare|einschätzen|Ich kann die Situation nicht einschätzen.|B2
iscrivere (bambino) a scuola|einschulen|Die Kinder werden im Herbst eingeschult.|B2
influenzare, agire su|einwirken auf A|Das Medikament wirkt auf den Körper ein.|B2
finire, terminare|enden|Die Vorstellung endet um 22 Uhr.|B2
mancare di, essere privo di|entbehren|Die Geschichte entbehrt jeder Logik.|B2
contrastare, combattere|entgegenwirken|Man muss den Problemen entgegenwirken.|B2
convalidare, svalutare|entwerten|Bitte entwerten Sie Ihre Fahrkarte.|B2
richiedere, esigere|erfordern|Diese Aufgabe erfordert viel Geduld.|B2
risultare, produrre, arrendersi|ergeben|Das Experiment ergab interessante Ergebnisse.|B2
afferrare, prendere (misure)|ergreifen|Die Regierung ergriff Maßnahmen gegen die Krise.|B2
mantenere, ricevere, ottenere|erhalten|Ich habe eine E-Mail erhalten.|B2
promulgare (legge), perdonare|erlassen|Das Parlament hat ein neues Gesetz erlassen.|B2
rinnovare|erneuern|Wir müssen die alte Heizung erneuern.|B2
acquisire, ottenere|erwerben|Er hat sich neue Sprachkenntnisse erworben.|B2
generare (profitto), produrre|erwirtschaften|Das Unternehmen erwirtschaftete einen hohen Gewinn.|B2
produrre, generare|erzeugen|Dieses Kraftwerk erzeugt Strom.|B2
tingere, colorare|färben|Sie lässt sich die Haare färben.|B2
ingrassare, lubrificare|fetten|Man muss die Kette fetten.|B2
tenere stretto, registrare|festhalten|Halten Sie sich gut fest!|B2
